{
  "catalogue_snapshot_date": "2026-08-12",
  "checks": {
    "cleanup": {
      "passed": true,
      "probe": {
        "command": [
          "powershell",
          "-NoProfile",
          "-Command",
          "@(Get-Process -Name 'quickpls-desktop' -ErrorAction SilentlyContinue).Count"
        ],
        "duration_seconds": 0.66,
        "returncode": 0,
        "stderr_tail": "",
        "stdout_tail": "0\n"
      }
    },
    "exact_archive": {
      "passed": true,
      "path": "validation/results/method_factory/cta_pls_v1/cta_pls_v1_packaged.qpls",
      "schema_version": 5,
      "sha256": "709f30262ee22632d07636874ffb9fb91f028cf5696f88e76ad6e8ac6d54121e"
    },
    "exact_xlsx": {
      "exact_values": {
        "archive_identity": true,
        "exact_sheet_order": true,
        "pairing_count": 3,
        "passed": true,
        "provenance_binds_same_run": true,
        "same_run_restored": true,
        "ui_matches_archive": true,
        "xlsx_matches_archive": true
      },
      "passed": true,
      "path": "validation/results/method_factory/cta_pls_v1/cta_pls_v1_packaged.xlsx",
      "sha256": "a52250e27bc66db97a7c989ac73439dd201d1157726eb6494df80a60b924fdd1",
      "sheets": [
        "CTA-PLS scope and exclusions",
        "CTA-PLS tetrad summary",
        "CTA-PLS tetrads",
        "Construct cross-validated redun",
        "Construct reliability and valid",
        "Cross loadings",
        "Fornell-Larcker criterion",
        "HTMT+",
        "Inner VIF values",
        "Model fit",
        "Original HTMT",
        "Outer loadings",
        "Outer weights",
        "Path coefficients",
        "R-square",
        "Run provenance",
        "Structural model",
        "Total effects",
        "f-square effect sizes"
      ]
    },
    "fail_closed_mutations": {
      "categories": {
        "checksum": {
          "archive": "validation/results/method_factory/cta_pls_v1/mutation_checksum.qpls",
          "execution": {
            "command": [
              "D:\\QuickPLS\\target\\debug\\qpls.exe",
              "inspect",
              "validation/results/method_factory/cta_pls_v1/mutation_checksum.qpls",
              "--json"
            ],
            "duration_seconds": 0.037,
            "returncode": 1,
            "stderr_tail": "Error: invalid project validation/results/method_factory/cta_pls_v1/mutation_checksum.qpls\n\nCaused by:\n    project recovery failed: primary failed (checksum mismatch for project.json); autosave is absent; backup is absent\n",
            "stdout_tail": ""
          },
          "passed": true,
          "sha256": "ab7d3296770274639ad694996492394cfd658325480098b6e4e0a4954c0522dd"
        },
        "dataset_fingerprint": {
          "archive": "validation/results/method_factory/cta_pls_v1/mutation_dataset_fingerprint.qpls",
          "execution": {
            "command": [
              "D:\\QuickPLS\\target\\debug\\qpls.exe",
              "inspect",
              "validation/results/method_factory/cta_pls_v1/mutation_dataset_fingerprint.qpls",
              "--json"
            ],
            "duration_seconds": 0.058,
            "returncode": 1,
            "stderr_tail": "Error: invalid project validation/results/method_factory/cta_pls_v1/mutation_dataset_fingerprint.qpls\n\nCaused by:\n    project recovery failed: primary failed (project archive is invalid: result ccea8d56-532b-4dd8-909f-66beba5c4c5a dataset fingerprint differs from its immutable analysis recipe); autosave is absent; backup is absent\n",
            "stdout_tail": ""
          },
          "passed": true,
          "sha256": "6a1e391173d20fbaf9b7c67b2a7a320cdf6a9f836f72b509b69d5283169ee5b6"
        },
        "feature_identity": {
          "archive": "validation/results/method_factory/cta_pls_v1/mutation_feature_identity.qpls",
          "execution": {
            "command": [
              "D:\\QuickPLS\\target\\debug\\qpls.exe",
              "inspect",
              "validation/results/method_factory/cta_pls_v1/mutation_feature_identity.qpls",
              "--json"
            ],
            "duration_seconds": 0.064,
            "returncode": 1,
            "stderr_tail": "Error: invalid project validation/results/method_factory/cta_pls_v1/mutation_feature_identity.qpls\n\nCaused by:\n    project recovery failed: primary failed (project archive is invalid: result ccea8d56-532b-4dd8-909f-66beba5c4c5a method differs from its immutable provenance settings); autosave is absent; backup is absent\n",
            "stdout_tail": ""
          },
          "passed": true,
          "sha256": "3ba4cff0ced2a3b1b0389f268cd345cbdb49891c4acc570e43bf923d416e86f5"
        },
        "legacy_reinterpretation": {
          "archive": "validation/results/method_factory/cta_pls_v1/mutation_legacy_reinterpretation.qpls",
          "execution": {
            "command": [
              "D:\\QuickPLS\\target\\debug\\qpls.exe",
              "inspect",
              "validation/results/method_factory/cta_pls_v1/mutation_legacy_reinterpretation.qpls",
              "--json"
            ],
            "duration_seconds": 0.058,
            "returncode": 1,
            "stderr_tail": "Error: invalid project validation/results/method_factory/cta_pls_v1/mutation_legacy_reinterpretation.qpls\n\nCaused by:\n    project recovery failed: primary failed (project archive is invalid: analysis recipe 9ae78658-3cc5-40a1-912a-a8e7038b362c is invalid: method_config.method_mismatch: method_config kind cta_pls is incompatible with settings.method pls_pm); autosave is absent; backup is absent\n",
            "stdout_tail": ""
          },
          "passed": true,
          "sha256": "a938cb53f4c6e4b72f98cc24c3aacf1737212d5e2fdb960f3f8fa836c64fd12d"
        },
        "malformed_payload": {
          "archive": "validation/results/method_factory/cta_pls_v1/mutation_malformed_payload.qpls",
          "execution": {
            "command": [
              "D:\\QuickPLS\\target\\debug\\qpls.exe",
              "inspect",
              "validation/results/method_factory/cta_pls_v1/mutation_malformed_payload.qpls",
              "--json"
            ],
            "duration_seconds": 0.048,
            "returncode": 1,
            "stderr_tail": "Error: invalid project validation/results/method_factory/cta_pls_v1/mutation_malformed_payload.qpls\n\nCaused by:\n    project recovery failed: primary failed (project archive is invalid: result ccea8d56-532b-4dd8-909f-66beba5c4c5a uses unsupported PLS payload versions); autosave is absent; backup is absent\n",
            "stdout_tail": ""
          },
          "passed": true,
          "sha256": "96882e73b18c77a6f251798a12d1185b3a4d2f3fbfd198427f0918a50be7c2ab"
        },
        "method_version": {
          "archive": "validation/results/method_factory/cta_pls_v1/mutation_method_version.qpls",
          "execution": {
            "command": [
              "D:\\QuickPLS\\target\\debug\\qpls.exe",
              "inspect",
              "validation/results/method_factory/cta_pls_v1/mutation_method_version.qpls",
              "--json"
            ],
            "duration_seconds": 0.056,
            "returncode": 1,
            "stderr_tail": "Error: invalid project validation/results/method_factory/cta_pls_v1/mutation_method_version.qpls\n\nCaused by:\n    project recovery failed: primary failed (project archive is invalid: result ccea8d56-532b-4dd8-909f-66beba5c4c5a uses unsupported PLS payload versions); autosave is absent; backup is absent\n",
            "stdout_tail": ""
          },
          "passed": true,
          "sha256": "b944a2ae888696996d0a364ac5007e9327cee60b295e0a064f323671dfe17443"
        }
      },
      "passed": true
    },
    "focused_report": {
      "focused_run": {
        "completedAt": "2026-08-13T18:55:45.807Z",
        "priorGeneratedAt": null,
        "scope": "cta_pls"
      },
      "generated_at_utc": "2026-08-13T18:55:02.834Z",
      "passed": true,
      "path": "validation/results/method_factory/cta_pls_v1/cta_pls_v1_packaged_raw.json",
      "sha256": "575cbe463c976c5e5ac477548171f301d5630ffebc6f92b98b1ef41c4407b45c"
    },
    "invalid_setup": {
      "evidence": {
        "archiveAfter": {
          "activeModelId": "aca941b8-9fe6-4105-b1a6-2a2a0dea2cdd",
          "datasetCount": 1,
          "manifestEngineVersion": "2.46.0",
          "modelCount": 1,
          "packageVersion": "2.46.0",
          "projectChecksum": {
            "actual": "be83641e469f14b1f929dc81ce0679992907d104d161e4ad7fcf5542655bca64",
            "expected": "be83641e469f14b1f929dc81ce0679992907d104d161e4ad7fcf5542655bca64",
            "matches": true
          },
          "recipeCount": 0,
          "resultCount": 0,
          "runCount": 0
        },
        "archiveBefore": {
          "activeModelId": "aca941b8-9fe6-4105-b1a6-2a2a0dea2cdd",
          "datasetCount": 1,
          "manifestEngineVersion": "2.46.0",
          "modelCount": 1,
          "packageVersion": "2.46.0",
          "projectChecksum": {
            "actual": "be83641e469f14b1f929dc81ce0679992907d104d161e4ad7fcf5542655bca64",
            "expected": "be83641e469f14b1f929dc81ce0679992907d104d161e4ad7fcf5542655bca64",
            "matches": true
          },
          "recipeCount": 0,
          "resultCount": 0,
          "runCount": 0
        },
        "attempted": true,
        "blockers": [
          "The model does not contain any constructs.",
          "The model does not contain any assigned indicators.",
          "Structural validity cannot be checked without constructs.",
          "CTA-PLS requires at least one ordinary construct with four or more assigned indicators."
        ],
        "eligibleBlockText": "None - assign at least four indicators to one ordinary construct",
        "resultCreated": false,
        "runStateUnchanged": true,
        "selectedMethod": "Confirmatory Tetrad Analysis",
        "startEnabled": false
      },
      "passed": true
    },